{
  "mapping_version": "1.0",
  "source": {
    "id": "replace-me",
    "title": "Replace with the exact dataset title",
    "edition_id": "replace-me",
    "edition_title": "Replace with the exact edition title",
    "language": "th",
    "source_url": null,
    "license": null,
    "citation": null
  },
  "input": {
    "format": "xml",
    "record_path": ".//REPLACE_WITH_RECORD_ELEMENT",
    "namespaces": {}
  },
  "fields": {
    "source_record_id": { "path": "@REPLACE_WITH_ID_ATTRIBUTE" },
    "lemma": { "path": "REPLACE_WITH_LEMMA_ELEMENT" },
    "pos": { "path": "REPLACE_IF_AVAILABLE" },
    "sense_number": { "path": "REPLACE_IF_AVAILABLE" },
    "definition": { "path": "REPLACE_IF_AVAILABLE" },
    "examples": { "path": "REPLACE_IF_AVAILABLE" },
    "synonyms": {
      "path": "REPLACE_IF_AVAILABLE",
      "sense_disambiguated": false
    }
  },
  "pos_mapping": {}
}
