{
  "mapping_version": "1.0",
  "source": {
    "id": "replace-me",
    "title": "Replace with the exact dataset title",
    "edition_id": "replace-me",
    "edition_title": "Replace with the exact edition title",
    "language": "th",
    "source_url": null,
    "license": null,
    "citation": null
  },
  "input": {
    "format": "csv",
    "encoding": null,
    "delimiter": null
  },
  "fields": {
    "source_record_id": { "path": "REPLACE_WITH_ID_COLUMN" },
    "lemma": { "path": "REPLACE_WITH_LEMMA_COLUMN" },
    "written_form": { "path": "REPLACE_IF_AVAILABLE" },
    "source_entry": { "path": "REPLACE_IF_AVAILABLE" },
    "pos": { "path": "REPLACE_IF_AVAILABLE" },
    "sense_number": { "path": "REPLACE_IF_AVAILABLE" },
    "definition": { "path": "REPLACE_IF_AVAILABLE" },
    "examples": { "path": "REPLACE_IF_AVAILABLE", "separator": "|" },
    "synonyms": {
      "path": "REPLACE_IF_AVAILABLE",
      "separator": "|",
      "sense_disambiguated": false
    },
    "antonyms": {
      "path": "REPLACE_IF_AVAILABLE",
      "separator": "|",
      "sense_disambiguated": false
    },
    "translations": {
      "path": "REPLACE_IF_AVAILABLE",
      "separator": "|",
      "language": "en"
    }
  },
  "pos_mapping": {}
}
